{
  "prompt": "Sunset is near and the weather is turning. What now?",
  "situation": {
    "narrative": "You are on a ridge trail with a friend.",
    "facts": [
      {
        "label": "Current time",
        "value": "4:51 PM"
      },
      {
        "label": "Sunset",
        "value": "6:42 PM"
      },
      {
        "label": "Distance remaining",
        "value": "4.7 miles"
      },
      {
        "label": "Weather",
        "value": "Deteriorating",
        "emphasis": "warning"
      },
      {
        "label": "Elevation gain left",
        "value": "1,200 ft"
      }
    ]
  },
  "options": [
    {
      "id": "continue",
      "label": "Continue",
      "verdict": "poor",
      "consequence": "You reach the summit in fading light and storm cloud with a long descent ahead.",
      "considerations": [
        "Daylight math is tight",
        "Weather trending worse"
      ]
    },
    {
      "id": "alternate",
      "label": "Take the alternate route",
      "verdict": "acceptable",
      "consequence": "Shorter, but unfamiliar terrain in worsening conditions.",
      "considerations": [
        "Shorter is good",
        "Unknown trail is a risk"
      ]
    },
    {
      "id": "turnaround",
      "label": "Turn around",
      "verdict": "best",
      "consequence": "You retrace known trail with hours of daylight to spare.",
      "considerations": [
        "Known route",
        "Margin of daylight and safety"
      ]
    }
  ],
  "expertNote": "Experienced hikers set a turnaround time in advance and honor it when conditions change.",
  "safetyNote": "This is a learning scenario, not navigation or safety training."
}
